title,level,experience,recruit_quantity,form_of_work,gender,describe,require,interest,company_name,company_link,job_link
DevOps Engineer,Nhân viên,2 năm,1 người,Toàn thời gian,Không yêu cầu,"Phối hợp với các thành viên khác để đề xuất, thực hiện triển khai tích hợp, kết nối các hệ thống hiện có và đảm bảo các giải pháp đề xuất có tiềm năng mở rộng.Lên phương án đề xuất tổng thể và chi tiết cho các giải pháp cần nghiên cứu. Làm việc tại văn phòng khách hàng của Công ty tại phường An Lợi Đông, TP.Thủ Đức","Có từ 2 năm kinh nghiệm làm việc với hệ thống phần mềm ở các vị trí như chuyên viên kỹ thuật  hoặc DevOps Engineer.Có kiến thức về quá trình phát triển phần mềm. Có kiến thức về một trong các ngôn ngữ lập trình: Node JS, Python, C#, Java...Có thể sử dụng thành thạo các công nghệ như Docker, Linux, AWS, AzureTốt nghiệp chuyên ngành CNTT hoặc các chứng chỉ khác tương đương.","Mức lương khởi điểm hấp dẫn, cạnh tranh, tương xứng với năng lực và kinh nghiệm làm việc lên đến 30 triệu/tháng + phụ cấp onsiteThu nhập: 13 tháng lương/năm + thưởng dự án lên đến 2 tháng lương/năm, thưởng Tết và các dịp lễ...Xét tăng lương 2 lần/năm: 1 lần theo định kỳ và 1 lần đột xuất theo năng lực và hiệu quả công việcNghỉ thứ 7, Chủ nhật + Phép năm tối thiểu 12 ngày theo Quy định của Pháp luật hiện hànhĐược tham gia bảo hiểm xã hội, bảo hiểm y tế, bảo hiểm thất nghiệp theo Quy định của Pháp luật hiện hànhBảo hiểm chăm sóc sức khỏe PVI sau 12 tháng làm việcĐược tham gia các Câu lạc bộ của Công ty: CLB Bóng đá, các CLB Cầu Lông.....Được tham gia các hoạt động tập thể sôi động của công ty: Nghỉ mát hàng năm, Teambuilding hàng quý, Sinh nhật công ty, Gala cuối năm....Có chính sách thăm hỏi ốm đau, thai sản, hiếu, hỉ, sinh nhật cho bản thân và người thânĐặc biệtĐược hỗ trợ 50% chi phí các khóa học bên ngoài, hỗ trợ 100% chi phí thi các chứng chỉ liên quan đến IT, các khóa học nâng cao kỹ năng mềm, được tăng ngay 1 bậc lương ngay khi nhận chứng chỉ Cơ hội làm việc và đào tạo tại Nhật Bản, Singapore với các ứng viên có tiếng Nhật hoặc tiếng AnhLàm việc trong môi trường trẻ trung, năng động, được hỗ trợ phát huy khả năng, phát triển công việc tối đa.",Công ty Cổ phần Công nghệ Phần mềm Tinh Vân,https://www.topcv.vn/cong-ty/cong-ty-co-phan-cong-nghe-phan-mem-tinh-van/102136.html,https://www.topcv.vn/viec-lam/devops-engineer/1478148.html?ta_source=ITJobs_LinkDetail
Senior Java Developer,Nhân viên,3 năm,1 người,Toàn thời gian,Không yêu cầu,"• Special benefit for candidates work in Daegu: housing allowance 500,000 KRW/monthAbout usA subsidiary of the FPT Group, FPT Software is known as a leading global information technology service provider headquartered in Vietnam. With over 30,000 employees working in 83 offices across 30 countries on five continents, FPT Software consistently delivers the best solutions to more than 1000 clients, including 100 Fortune 500 companies. Placing human resources as the cornerstone of its achievements, employee experience is our top priority in continually creating an innovative, open, and enjoyable work environment for every member.In 2023, FPT Software officially made its mark on the global billion-dollar company list. This is evidence of the talent and efforts of multiple generations of employees at FPT Software.Why not explore your potential and embark on a brilliant journey with us?Job Brief• We are looking for Senior Java Developer to join our software team developing advanced software components and expand business in Korea.Responsibilities• Design, develop, and maintain high-quality software applications using Java, Spring Boot, and related technologies.• Build and maintain RESTful Web Services and ensure integration with various back-end systems.• Work with relational and NoSQL databases to manage and manipulate large datasets.• Apply best practices in software engineering to ensure code quality and maintainability.• Collaborate with cross-functional teams to define, design, and deliver new features.• Contribute to improving software architecture and support the transition to microservices and serverless architectures.• Write clean, efficient, and well-documented code.• Participate in Agile ceremonies, including sprint planning, stand-ups, and retrospectives.","Basic Qualifications• At least 3 years of experience and knowledge of Java.• Strong experience in Spring-Boot and RESTful Web Services.• Experience with RDBMS, SQL, and object/relational mappings, dealing with large data (MySQL, Oracle, SQL Server, Postgres...), NoSQL (MongoDB, Cassandra...).• Strong knowledge of modern software engineering principles, patterns, and best practices. Understanding of micro-service and serverless architectures.• TOPIK level 5 or higher (Korean language proficiency).Nice to have:• Knowledge of the Agile methodology (Scrum).• Knowledge of CI/CD (Jenkins, Docker) and clean-code tools such as Sonar• Experience and/or certifications on Amazon, Azure and Oracle clouds.• Experience in Web development (Angular, ReactJS, Node.JS)• Experience in leading a project or team• Communication – English Language – Written and verbal• Knowledge about Linux/ Linux Shell scripting• Knowledge of JavaScript, HTML, XML, CSS, jQuery.","• Special benefit for candidates work in Daegu: housing allowance 500,000 KRW/month• Competitive salary package with performance-based incentives.• Comprehensive health and wellness benefits.• Exciting projects and opportunities to work with leading clients across various industries.• Opportunities for professional growth and advancement within the organization.• Dynamic and collaborative work environment with a diverse team of talented professionals.• Other benefits as company regulation.",FPT Software,https://www.topcv.vn/cong-ty/fpt-software/3.html,https://www.topcv.vn/viec-lam/senior-java-developer/1479784.html?ta_source=ITJobs_LinkDetail
"Fresher/Junior
            Business Analyst
        (Cộng Tác Viên)",Nhân viên,Dưới 1 năm,1 người,Toàn thời gian,Không yêu cầu,"GIỚI THIỆU CHUNG:VinBigdataCông ty cổ phần Vinbigdata được thành lập theo định hướng trở thành tập đoàn Công nghệ – Công nghiệp – Thương mại Dịch vụ hàng đầu Việt Nam của Vingroup. Với lợi thế đặc biệt về hạ tầng dữ liệu lớn, Vinbigdata cung cấp các sản phẩm, giải pháp tiên ứng dụng trí tuệ nhân tạo, giúp doanh nghiệp đẩy nhanh quá trình chuyển đổi số, tối ưu hiệu quả vận hành, kinh doanh và gia tăng trải nghiệm người dùng cuối.Là một công ty trẻ trung và đang trong giai đoạn phát triển nhanh chóng, Vinbigdata luôn chào đón những tài năng gia nhập công ty để cùng thực hiện mục tiêu “Công nghệ Việt – Vì tương lai Việt”.Chúng tôi đề cao và tìm kiếm các nhân sự có tinh thần sáng tạo, đam mê tạo ra những sản phẩm và dịch vụ mới giúp người Việt Nam có cuộc sống tiện lợi, văn minh và lành mạnh hơn, sẵn sàng thử thách bản thân, học hỏi và chịu được áp lực lớn trong công việc.Giới thiệu về phòng ban chuyên môn/ dự án:Khi bạn sử dụng chatbot / voicebot, hoặc gọi điện thoại đến Tổng đài CSKH của doanh nghiệp (gọi tắt là callbot), bạn có thể hỏi hầu như bất kể thứ gì liên quan đến sản phẩm / dịch vụ của doanh nghiệp đó. Trong thiết kế hội thoại cho chatbot / voicebot / callbot (gọi chung là “bot” hoặc trợ lý ảo), bot có thể trả lời những thứ mà nó được huấn luyện từ trước. Khi bạn xây dựng các hệ thống tích hợp trong doanh nghiệp, chuyên thiết kế & phát triển bot, bạn chịu trách nhiệm cho toàn bộ phần trải nghiệm khách hàng của bot. Từ việc dựng chân dung bot, mục đích công việc, xây dựng nội dung hội thoại, tạo luồng hội thoại, sau đó kiểm thử và chạy đi chạy lại đảm bảo mọi thứ hoạt động đúng đắn và đầy đủ.Trong nhiều năm qua, chúng tôi phát triển nền tảng Trợ lý ảo VinBase giúp các doanh nghiệp triển khai giải pháp bot theo đặc thù sản phẩm & dịch vụ của họ. Và cũng theo trào lưu Generative AI, VinBase hiện đã cho phép cấu hình luồng, xây dựng kịch bản, quản lý tri thức giúp doanh nghiệp thiết kế & ứng dụng bot nhanh và hiệu quả hơn rất nhiều.Là người thiết kế hội thoại dựa trên nền tảng AI (CAD – Conversation AI Designer), bạn sẽ làm việc với đội phát triển, BA, QC, và các kỹ sư NLP & Speech (xử lý ngôn ngữ tự nhiên và giọng nói) để phân tích và xây dựng các giải pháp bot cho doanh nghiệp. Chúng tôi tìm kiếm những người ham học hỏi, có động lực cao, và muốn thăng tiến trong môi trường chuyên biệt về phát triển AI. Sau cùng thì bạn cũng chính là những người có ảnh hưởng lớn nhất đến khách hàng.MÔ TẢ CÔNG VIỆC1. Nghiên cứu & tìm hiểu yêu cầu nghiệp vụ, yêu cầu hệ thống từ BA hoặc các bên liên quan. Dựa vào kinh nghiệm và hiểu biết, góp ý & hỗ trợ BA hoàn thiện yêu cầu chi tiết.2. Thiết kế luồng hội thoại tương tác giữa tài xế (khách hàng) và bot trong nhiều ngữ cảnh và các dòng xe khác nhau, sử dụng nền tảng VinBase (do đội ngũ VinBigdata phát triển). Sử dụng các phần mềm như Draw. io, Figma để thiết kế luồng.Đồng thời, thiết kế được kịch bản cho các tình huống ngoại lệ, các trường hợp rẽ nhánh so với luồng chính, để đảm bảo bot hoạt động đúng và nhất quán.3. Huấn luyện model (trên VinBase). Kiểm thử (unit-testing), rà soát & sửa lỗi các kịch bản trước khi bàn giao cho QC .4. Phối hợp với BA, QC và NLP, Speech đảm bảo các kịch bản, ý định (intent), và entity (thực thể) có thể triển khai được và thông suốt từ yêu cầu, thiết kế bot, và triển khai lên các môi trường hệ thống.5. Hỗ trợ QC trong quá trình UAT trước khi bàn giao cho khách hàng, bao gồm các việc xác nhận lỗi và rà soát nguyên nhân cốt lõi của vấn đề.6. Các công việc khác theo phân công của cấp trên.","YÊU CẦUCử nhân/Kỹ sư các trường Đại học nói chung (ưu tiên Kỹ sư CNTT, Hệ thống thông tin, hoặc Đại học Ngoại Thương).Giao tiếp mạch lạc, rõ ràng. Tư duy logic tốt, có khả năng làm việc với cường độ cao.Chủ động trong công việc. Có tinh thần trách nhiệm và quyết liệt hướng đến giải quyết vấn đề chung của dự án.Có kinh nghiệm kiểm thử (testing) là một lợi thế.Tiếng Anh (bắt buộc)","Địa điểm làm việc: Tầng 9, tòa nhà Century, Times City, 458 Minh Khai, Hà NộiThời gian làm việc: 40 giờ/ tuần (từ Thứ Hai tới Thứ Sáu)Chế độ phúc lợi:Mức lương hấp dẫn, tương xứng với năng lực và cạnh tranh trên thị trường.Cơ hội phát triển:Cơ hội làm việc trong môi trường chuyên nghiệp, công nghệ dẫn đầu về AI,  quy tụ hơn 100 nhà khoa học, chuyên gia, kỹ sư đến từ các trường đại học hàng đầu thế giới và Việt Nam như: ĐH Yale (Mỹ), ĐH Johns Hopkins (Mỹ), ĐH Illinois (Mỹ), ĐH Toulouse (Pháp), ĐH Cambridge (Anh Quốc), Đại học Bách Khoa, Đại học Công nghệ – Đại học Quốc gia, ...Được xây dựng kế hoạch phát triển cá nhân và tham gia đào tạo kỹ năng, chuyên môn phù hợp.Môi trường làm việc:Văn phòng hiện đại, tiện nghi, trẻ trung và chuyên nghiệp.Môi trường làm việc cởi mở, khuyến khích nhân viên đóng góp ý kiến, sáng kiến, ý tưởng.",Công ty Cổ phần VinBigData,https://www.topcv.vn/cong-ty/cong-ty-co-phan-vinbigdata/142397.html,https://www.topcv.vn/viec-lam/fresher-junior-business-analyst-cong-tac-vien/1479754.html?ta_source=ITJobs_LinkDetail
Android Developer,Nhân viên,1 năm,1 người,Toàn thời gian,Không yêu cầu,"Tham gia phát triển hoặc vận hành các dự án Android.Cụ thể công việc: tham gia thiết kế, phân tích, code, viết unit test, review code, hỗ trợ deploy lên các môi trường.Nghiên cứu và ứng dụng các công nghệ mới vào phát triển sản phẩm nếu cần thiết.Báo cáo kết quả công việc cho PM.","Có từ 1 năm kinh nghiệm nghiệm phát triển app Android (Java/Kotlin).Có tư duy logic, sử dụng thuật toán tốt.Có khả năng học hỏi nghiệp vụ lẫn công nghệ mới.Có khả năng tìm hiểu và xử lý một số bài toán khó, tối ưu Performance.Có kinh nghiệm làm việc với REST API.Ưu tiên ứng viên có thể làm việc với các framework multi-platform như ReactNative, Flutter...Ưu tiên có kinh nghiệm và tư duy hệ thống và đã có kinh nghiệm build app...Có sản phẩm trên store hoặc có kinh nghiệm xử lý các vấn đề kỹ thuật của Quảng cáo (Google, Facebook, DFP,...) trên app là một lợi thếƯu tiên các bạn nắm chắc về android core và Android open source project","Mức lương upto 25.000.000 VNĐ /tháng (lương net) + thưởng % dự án. Package lương từ 14-20 tháng lương/năm. Thử việc 100% lương.Review tăng lương không giới hạn theo năng lực và hiệu quả công việc.Thời gian làm việc: 7.5 tiếng/ngày ( Sáng từ 8h45-12h; chiều từ 13h30-18h nghỉ chiều từ 15h30 - 15h45), làm việc từ Thứ 2 - Thứ 6.Phúc lợi: Sinh nhật, Hiếu, Hỉ, Ốm đau; hỗ trợ tiền ăn trưa và gửi xe hàng tháng.Nghỉ phép: 12 ngày/năm (đối với nam), 18 ngày/năm (đối với nữ).Môi trường làm việc thoải mái, năng động, trẻ trung.Được hỗ trợ tối đa các nhu cầu về thiết bị máy móc cấu hình cao và không gian giải trí bao gồm các khu vực bida, PS5...Được hưởng đầy đủ chế độ theo quy định của nhà nước (nghỉ lễ, nghỉ phép, Bảo hiểm xã hội, Bảo hiểm Y tế...).Chế độ khám sức khỏe hàng năm và được đóng bảo hiểm sức khỏe cho cá nhân và gia đìnhCác hoạt động du lịch, dã ngoại hàng quý, liên hoan cố định hàng tháng.",Công ty TNHH Dmobin,https://www.topcv.vn/cong-ty/cong-ty-tnhh-dmobin/47248.html,https://www.topcv.vn/viec-lam/android-developer/1295727.html?ta_source=ITJobs_LinkDetail
"Nhân Viên Triển Khai
        Trạm BTS",Nhân viên,Không yêu cầu kinh nghiệm,12 người,Toàn thời gian,Không yêu cầu,"Lắp đặt thiết bị trạm BTS cùng các thành viên khác trong độiThực hiện các công tác từ yêu cầu cấp trên.Quản lý thiết bị, công dụ dụng cụ, vật tư tài sản được cung cấpBáo cáo công việc hàng ngày theo quy định","Nam, ưu tiên đã có kinh nghiệm về liên quan đến trạm BTSTrình độ: Trung cấp trở lên các chuyên ngành kỹ thuật, CNTT, điện tử viễn thông, Điện, điện tử, điện lạnh, tự động hóa...Chịu khó, nhiệt tìnhChưa có kinh nghiệm, sẽ được công ty đào tạo.","Thu nhập: từ 12.000.000 – 16.000.000 đồng/thángBHXH & BHYT theo quy định của nhà nướcĐược hưởng lương tháng 13, chế độ nghỉ phép, lễ, thưởng thành tích và công tác phí theo quy định của Công ty.Quà ngày Lễ Tết, Sinh nhật, Thưởng cuối năm;Chế độ khám sức khỏe, Du lịch, team building hằng năm.",CÔNG TY CỔ PHẦN VIỄN THÔNG ACT MIỀN NAM,https://www.topcv.vn/cong-ty/cong-ty-co-phan-vien-thong-act-mien-nam/81708.html,https://www.topcv.vn/viec-lam/nhan-vien-trien-khai-tram-bts/1479706.html?ta_source=ITJobs_LinkDetail
Android Developer,Nhân viên,1 năm,1 người,Toàn thời gian,Không yêu cầu,"•	Lập trình các sản phẩm App Android. 
•	Phát triển và nghiên cứu các tính năng mới cho app. 
•	Nghiên cứu nắm bắt công nghệ mới thích hợp để giải quyết vấn đề.
•	Triển khai sản phẩm, chủ động sáng tạo tính năng mới dựa trên định hướng chung của công ty. 
•	Viết các tài liệu kỹ thuật liên quan đến dự án.","Kỹ năng & Chuyên môn:
•	Tốt nghiệp CĐ/ĐH chuyên ngành CNTT hoặc các chuyên ngành liên quan
•	Kinh nghiệm 1 - 2 năm làm việc với Kotlin.
•	Có kinh nghiệm với các mô hình MVP, MVVM, biết modular architecture là lợi thế
•	Nắm được các kiến thức về customview, xử lý layout, thread, service, broadcast receiver,... 
•	Có kinh nghiệm lưu trữ dữ liệu offline, quản lý bộ nhớ, xử lý đa luồng.
•	Có kinh nghiệm làm việc với các Third-Party, Library.
•	Có kinh nghiệm làm việc với SERVER SIDE, BLE, RESTFUL API.
•	Biết sử dụng công cụ quản lý source code GIT
•	Có tinh thần trách nhiệm, chủ động với công việc và đồng nghiệp; sẵn sàng học hỏi cái mới.
•	Có khả năng làm việc độc lập hoặc làm việc theo nhóm và chịu được áp lực công việc cao.
•	Tiếng Anh đọc hiểu tài liệu
Có một trong các tiêu chí sau đây là lợi thế:
•	Có kiến thức về UI/UX.
•	Có sản phẩm được public trên Store.
•	Biết Sử dụng Adobe Photoshop, Adobe Illustrator, Adobe Premiere.","•	Mức lương 15tr-30tr tùy vào năng lực
•	Thưởng lễ, tết, tháng lương 13, KPI, và các chế độ khác theo quy định của Pháp luật hiện hành.
•	Teambuilding định kỳ, du lịch hàng năm
Thời gian & địa điểm làm việc:
•	Từ thứ 2 đến thứ 6, và 1 tháng làm 2 thứ 7.
•	Tòa vinaconex 1, ngõ 289A Khuất Duy Tiến, Cầu Giấy, Hà Nội",CÔNG TY CỔ PHẦN CÔNG NGHỆ CAO CTECH,https://www.topcv.vn/cong-ty/cong-ty-co-phan-cong-nghe-cao-ctech/143545.html,https://www.topcv.vn/viec-lam/android-developer/1461579.html?ta_source=ITJobs_LinkDetail
"Fresher
        
            Front-End Developer
        (Angular)",Thực tập sinh,Không yêu cầu kinh nghiệm,5 người,Toàn thời gian,Không yêu cầu,On job training trong 3 tháng về công nghệ Angular trong phát triển phần mềm.Tham gia các dự án lớn về thương mại điện tử và ngân hàngCác công việc khác được giao bởi quản lí trực tiếp,"Sinh viên năm cuối hoặc đã tốt nghiệp trong lĩnh vực Công nghệ thông tin hoặc các ngành liên quanCó kiến thức / kinh nghiệm cơ bản về Angular 12+Có kiến thức sâu về CSS, SCSS/SASS.Có kinh nghiệm sử dụng MUI/Bootstrap hoặc các framework UI khác.Có kiến thức về JWT hoặc Session authentication.Có kiến thức và kinh nghiệm sử dụng các thư viện linting/formating (ESLint, Prettier).Điểm cộng khi có kiến thức/kinh nghiệm về OAuth và/hoặc SAML.Có thể tham dự đào tạo full-timeCó khả năng tự học và làm việc nhómTiếng Anh đọc hiểu cơ bảnCam kết làm việc một năm sau khi tốt nghiệp được chương trình đào tạo","Được đào tạo cơ bản 3 tháng về công nghệ.Nhận trợ cấp bằng tiền mặt hàng tháng theo năng lực lên tới 6.000.000 VND. Cơ hội trở thành nhân viên sau khi hoành thành chương trình đào tạo.Được tham gia làm dự án ngân hàng với khách hàng lớn của Việt Nam.  Có cơ hội đi onsite tại Châu Âu, Úc, Singapore, Nhật Bản khi trở thành nhân viên chính thức. Được làm trong môi trường Văn hóa chuyên nghiệp, trẻ trung và năng động",Công Ty SmartOSC,https://www.topcv.vn/cong-ty/cong-ty-smartosc/65.html,https://www.topcv.vn/viec-lam/fresher-front-end-developer-angular/1479682.html?ta_source=ITJobs_LinkDetail
Python Developer,Nhân viên,1 năm,1 người,Toàn thời gian,Không yêu cầu,"Tham gia thiết kế và phát triển API cho các ứng dụng quản lý nhân sự HRMXây dựng và tối ưu hóa các API, microserviceNghiên cứu, học hỏi các công nghệ mới phục vụ nhu cầu dự án, quản lý công việc, tiến độ, chất lượng dự ánThực hiện các công việc khác theo yêu cầu của quản lý sản phẩm","Tốt nghiệp các trường chuyên ngành Công nghệ thông tin, Khoa học máy tính, Điện tử viễn thông, Công nghệ phần mềm, Hệ thống thông tinCó ít nhất 2 năm kinh nghiệm & thành thạo ngôn ngữ lập trình PythonCó ít nhất 1 năm với một trong các framework Python như: FastAPI,Flask/Django...Có kinh nghiệm làm việc với các hệ cơ sở dữ liệu: PostgreSQL, MongoDB, MySQL...Có kinh nghiệm làm việc với hệ thống message queue như Celery, Redis queueHiểu biết về các kiến trúc phát triển phần mềm: Microservices, MonolithicThành thạo công cụ quản lý mã nguồn Git. Viết tài liệu cho APISử dụng các công cụ như JIRA, Clickup hoặc Redmine để quản lý công việcĐam mê, chủ động trong công việc, có kỹ năng làm việc nhóm và làm việc độc lậpCó khả năng quản lý, sắp xếp, điều phối và đốc thúc công việcCó khả năng đọc hiểu các tài liệu bằng tiếng AnhƯu tiên các ứng viên trẻ từ 2000","Mức lương thỏa thuận, được trả theo năng lựcĐược tham gia vào môi trường văn hóa năng động, chuyên nghiệpHưởng đầy đủ các chế độ theo Luật Lao Động: Nghỉ lễ, tết, phép năm, hiếu, hỷ...Tham gia BHXH - BHYT - BHTN theo quy định của Nhà nước, bảo hiểm tai nạn UIC, bảo hiểm sức khỏe PTIĐược chăm sóc tiếp sức với tủ thức ăn đầy ắp vào cuối thángĐược cấp phát Laptop, đồng phục thực hiện công việcCó lộ trình thăng tiến rõ ràng",iPOS.vn,https://www.topcv.vn/cong-ty/ipos-vn/3318.html,https://www.topcv.vn/viec-lam/python-developer/1479327.html?ta_source=ITJobs_LinkDetail
