title,level,experience,recruit_quantity,form_of_work,gender,describe,require,interest,company_name,company_link,job_link
QA/QC,,3 năm,,,,"Tham gia phân tích yêu cầu cho các dự án phát triển phần mềm của khách hàng thị trường Nhật BảnTạo test scenario, test checklist, test case...Tạo test data, thiết lập môi trường kiểm thử.Lên plan và control plan, chất lượng dự án.Báo lỗi, giám sát việc sửa lỗi của nhà phát triển và đảm bảo chất lượng của phần mềm.Đánh giá test result và viết test report.Đề xuất, điều chỉnh quy trình phát triển sản phẩm phù hợp với yêu cầu cụ thể của từng dự án, kiểm soát đảm bảo thực hiện đúng quy trình đã thống nhất.Kiểm soát tiến độ và chất lượng dự án. (Ứng viên chưa có kinh nghiệm sẽ được đào tạo)Đánh giá/Phát hiện rủi ro, đưa ra giải pháp phòng tránh rủi ro và giải quyết vấn đề.Mentor và train intern/junior QC (nếu chưa có kinh nghiệm sẽ được đào tạo)","Có từ 3.5 năm kinh nghiệm test web/ test app trên thiết bị di động Có kiến thức chung liên quan đến kiểm thử: định nghĩa cơ bản, thuật ngữ và quy trình phát triển phần mềmCó kinh nghiệm làm việc sử dụng tool với API, SQLCó khả năng phân tích và chuyển các yêu cầu sang tài liệu.Có khả năng Q&A và đàm phán với khách hàng.Đọc hiểu tốt và tạo tài liệu kiểm tra bằng tiếng Anh: test plan, test design, test viewpoint, checklist, test casesQuản lý, phân tích, theo dõi kết quả test từ đó báo cáo và đánh giá chất lượng sản phẩmCó thể review ouput của các member trong teamKỹ năng tổ chức và quản lý; tự nghiên cứu, định nghĩa và quản lý tài liệu testKỹ năng đọc viết tài liệu bằng tiếng anhĐã từng làm việc với môi trường có áp lực caoỨng viên có mong muốn làm việc với khách hàng thị trường NhậtỨng viên có kinh nghiệm trong mảng blockchain là lợi thế (không bắt buộc)","1 .Chính sách phát triển nhân lựcPhát triển nguồn nhân lực chất lượng cao là mục tiêu ưu tiên hàng đầu tại Newwave Solutions. Do đó, chúng tôi luôn không ngừng xây dựng và hoàn thiện những chính sách để thu hút, bồi dưỡng và đãi ngộ xứng đáng đối với nhân tài như:Với văn hóa học tập mạnh mẽ Newwave thường xuyên tổ chức các khóa đào tạo nội bộ hoặc gửi nhân sự đi đào tạo tại các cơ sở uy tín để giúp nhân sự nâng cao cả kỹ năng chuyên môn và kỹ năng mềmCó quy chế đảm bảo phúc lợi và quyền lợi cho nhân viên nhằm tăng sự gắn kết của nhân viên với công ty, tạo điều kiện cho nhân viên tập trung làm việc và cống hiếnCơ chế lương thưởng rõ ràng, đảm bảo tính minh bạch và công bằngĐịnh kỳ tổ chức các sự kiện chăm sóc đời sống vật chất lẫn tinh thần của nhân viên vào các dịp lễ, Tết hoặc sự kiện quan trọng (sinh nhật công ty, teambuilding, du lịch hè ...)2. Cơ hội thăng tiếnĐến với Newwave Solutions, ứng viên có cơ hội được:Làm việc trong môi trường trẻ trung, thân thiện, minh bạch với cơ hội thăng tiến rõ ràngĐược tạo điều kiện tối đa để phát triển năng lực cá nhân, tập thể và năng suất làm việc3. Chế độ đãi ngộLương thỏa thuận theo năng lực  (up to 25M gross)Thưởng lương tháng 13, thưởng hiệu quả theo tình kinh doanh của công ty, thưởng đột xuất theo năng lực cá nhân, ...Thử việc 2 tháng: nhận 100% mức lươngĐược hưởng BHXH, BHYT, BHTN theo chế độ nhà nước ban hành.Bảo hiểm Sức khỏe cao cấp dành cho toàn bộ CBNV (sau khi ký HĐLĐ 1 năm)Chế độ thâm niênKhám sức khỏe 1 lần/nămReview performance: 2 đợt/nămĐược tham gia các Câu lạc bộ của Công ty: CLB Bóng đá, các CLB Game, CLB Gym, CLB Cầu Lông, Media...Quà Tết, Quà sinh nhật công ty, Quà chào mừng nhân viên mới, Quà các dịp lễ ...Đặc biệt:Được tham gia các lớp học nội bộ miễn phí tại công ty với đội ngũ giảng viên dày dặn kinh nghiệm.Được hỗ trợ khi tham gia các khóa đào tạo bên ngoài.Chính sách hỗ trợ các hoạt động học tập, trao đổi, chia sẻ kiến thứcNgày làm việc: 5 ngày/tuần. Từ T2-T6, nghỉ T7, CN, Lễ Tết.Địa điểm làm việc: tòa Mitec, Dương Đình Nghệ, Yên Hòa, Cầu GiấyChấm công linh hoạt: 8 tiếng/ngày, có thể bắt đầu trong khoảng 8h30 - 9h00 và kết thúc trong khoảng 17h30 đến 18h00",Newwave Solutions JSC,https://www.topcv.vn/brand/newwavesolutions?id=14514,https://www.topcv.vn/brand/newwavesolutions/tuyen-dung/middle-manual-tester-qa-qc-en-doc-viet-j1475535.html?ta_source=ITJobs_LinkDetail
Tester,,3 năm,,,,"Tham gia phân tích yêu cầu cho các dự án phát triển phần mềm.Tạo test scenario, test checklist, test case... Tạo test data, thiết lập môi trường kiểm thử.Thực hiện kiểm tra theo kế hoạch và kịch bản kiểm tra.Báo lỗi, giám sát việc sửa lỗi của nhà phát triển và đảm bảo chất lượng của phần mềm.Đánh giá test result và viết test report.Đề xuất, điều chỉnh quy trình phát triển sản phẩm phù hợp với yêu cầu cụ thể của từng dự án, kiểm soát đảm bảo thực hiện đúng quy trình đã thống nhất.Phát hiện rủi ro, đưa ra giải pháp phòng tránh rủi ro và giải quyết vấn đề.Mentor và train intern/junior QC.","1. Kỹ năng bắt buộc:Có ít nhất 3 năm kinh nghiệm test web/ test app trên thiết bị di động (không tính thời gian thực tập)Thành thạo tiếng Anh ở các kỹ năng đọc và viết và có thể giao tiếp với khách hàng.Có kiến thức chung liên quan đến kiểm thử: định nghĩa cơ bản, thuật ngữ và quy trình phát triển phần mềmCó kinh nghiệm làm việc với API, Database.Có khả năng phân tích và chuyển các yêu cầu sang tài liệu.Có khả năng Q&A và đàm phán với khách hàng.Đọc hiểu tốt và tạo tài liệu kiểm tra bằng tiếng Anh: test plan, test design, test viewpoint, checklist, test casesQuản lý, phân tích, theo dõi kết quả test từ đó báo cáo và đánh giá chất lượng sản phẩmCó thể review ouput của các member trong teamNăng động trong công việc, nhanh nhẹn, sáng tạo và ham học hỏi.Cẩn thận, tỉ mỉ. Chịu khó và cầu tiếnKhả năng làm việc nhóm tốt và có thể chịu được áp lực.2. Kỹ năng không bắt buộc, bạn có là một lợi thế:Ứng viên có kinh nghiệm trong mảng game hoặc blockchainCó khả năng tự học những domain mới, tool mới phục vụ công việcKỹ năng tổ chức và quản lý; tự nghiên cứu, định nghĩa và quản lý tài liệu testCó kỹ năng quản lý nhóm trên 2 thành viên và có khả năng đào tạo các thành viên khác các kỹ năng, quy trình liên quan đến kiểm thử.","1 .Chính sách phát triển nhân lựcPhát triển nguồn nhân lực chất lượng cao là mục tiêu ưu tiên hàng đầu tại Newwave Solutions. Do đó, chúng tôi luôn không ngừng xây dựng và hoàn thiện những chính sách để thu hút, bồi dưỡng và đãi ngộ xứng đáng đối với nhân tài như:Với văn hóa học tập mạnh mẽ Newwave thường xuyên tổ chức các khóa đào tạo nội bộ hoặc gửi nhân sự đi đào tạo tại các cơ sở uy tín để giúp nhân sự nâng cao cả kỹ năng chuyên môn và kỹ năng mềmCó quy chế đảm bảo phúc lợi và quyền lợi cho nhân viên nhằm tăng sự gắn kết của nhân viên với công ty, tạo điều kiện cho nhân viên tập trung làm việc và cống hiếnCơ chế lương thưởng rõ ràng, đảm bảo tính minh bạch và công bằngĐịnh kỳ tổ chức các sự kiện chăm sóc đời sống vật chất lẫn tinh thần của nhân viên vào các dịp lễ, Tết hoặc sự kiện quan trọng (sinh nhật công ty, teambuilding, du lịch hè ...)2. Cơ hội thăng tiếnĐến với Newwave Solutions, ứng viên có cơ hội được:Làm việc trong môi trường trẻ, minh bạch với cơ hội thăng tiến rõ ràngĐược tạo điều kiện tối đa để phát triển năng lực cá nhân, tập thể và năng suất làm việc3. Chế độ đãi ngộLương thỏa thuận theo năng lực (Up to 25M)Thưởng lương tháng 13, thưởng hiệu quả theo tình kinh doanh của công ty, thưởng đột xuất theo năng lực cá nhân, ...Thử việc 2 tháng: nhận 100% mức lươngĐược hưởng BHXH, BHYT, BHTN theo chế độ nhà nước ban hành.Bảo hiểm Sức khỏe cao cấp dành cho toàn bộ CBNV (sau khi ký HĐLĐ 1 năm)Chế độ thâm niênKhám sức khỏe 1 lần/nămReview performance: 2 lần/nămĐược tham gia các Câu lạc bộ của Công ty: CLB Bóng đá, các CLB Game, CLB Gym, CLB Cầu Lông, Media...Quà Tết, Quà sinh nhật công ty, Quà chào mừng nhân viên mới, Quà các dịp lễ ...Đặc biệt:Được tham gia các lớp học nội bộ miễn phí tại công ty với đội ngũ giảng viên dày dặn kinh nghiệm.Được hỗ trợ khi tham gia các khóa đào tạo bên ngoài.Chính sách hỗ trợ các hoạt động học tập, thi các chứng chỉ chuyên môn, khuyến khích các hoạt động trao đổi chia sẻ kiến thức.Ngày làm việc: 5 ngày/tuần. Từ T2-T6, nghỉ T7, CN, Lễ Tết.Địa điểm làm việc: tòa Mitec, Dương Đình Nghệ, Yên Hòa, Cầu GiấyChấm công linh hoạt: 8 tiếng/ngày, có thể bắt đầu trong khoảng 8h30 - 9h00 và kết thúc trong khoảng 17h30 đến 18h00",Newwave Solutions JSC,https://www.topcv.vn/brand/newwavesolutions?id=14514,https://www.topcv.vn/brand/newwavesolutions/tuyen-dung/middle-qa-manual-tester-english-market-j1475536.html?ta_source=ITJobs_LinkDetail
Frontend Developer,,3 năm,,,,"Build web application UIs using modern technologies (HTML5, CSS3, JavaScript, etc.) and Angular framework.Participate in all stages of development: requirement analysis, estimation, implementation, code review, unit testing, and overall testing.Directly collaborate with clients to resolve issues, finalize requirements, and ensure technical outcomes align with business objectives.Collaborate with cross-functional teams to deliver high-quality web interfaces and applications.Optimize existing products for improved efficiency.Continuously learn new technologies and stay updated on industry trends.Contribute to technical and user documentation.Mentor and train intern/junior developers.","Technical Skills:Proficient in HTML5, CSS3, and JavaScriptHave deep knowledge of Javascript and Typescript3+ years experience working with AngularFamiliarity with RESTful APIs and GraphQLExperience with responsive and adaptive design across browsers and platformsDebugging skills and strong sense of UI/UX design principlesFamiliarity with Git/Git-flow and code review processesAbility to write clean, maintainable, and well-documented codeStrong problem-solving skillsSoft Skills: Eager to learn, ability to solve problems under pressureEnglish conversational communication skills from Intermediate level and aboveOptional Skills:Experience working with cloud services such as AWS, Google Cloud Platform, or AzureExperience with JavaScript libraries like jQueryHands-on experiences with TDD, BDD, ATDDBuild tools (Webpack, BabelJS)","1. Human Resource Development PolicyDeveloping a high-quality workforce is a top priority at Newwave Solutions. We, therefore, continuously build and refine policies to attract, nurture, and reward talented individuals. Our strategies include:Fostering a Strong Learning Culture: Newwave Solutions regularly conducts internal training programs and sends employees to reputable institutions to enhance both their professional and soft skills.Ensuring Employee Well-being and Rights: We implement regulations that ensure employee welfare and rights, fostering stronger bonds between employees and the company and creating an environment for focused work and dedication.Transparent and Equitable Compensation: We have established a transparent and equitable system for salary and bonuses.Promoting Well-being: We organize regular events to care for the physical and mental well-being of employees during holidays, festivals, birthdays, team-building activities, and summer trips.2. Advancement OpportunitiesBy joining Newwave Solutions, candidates can benefit from:A Youthful and Transparent Environment: We offer a youthful and transparent environment with clear paths for career advancement.Developing Personal and Professional Skills: We provide maximum opportunities to develop personal, collective, and work productivity capabilities.3. Compensation and BenefitsCompetitive Salary, up to 28MBonuses: 13th-month salary, performance-based bonuses tied to the company's business performance, individual capacity, etc.Full Salary During Probation: Employees receive 100% of their salary during the probationary period.Social and Health Insurance: Social insurance, health insurance, and unemployment insurance as regulated by the government. Social insurance payment is processed during the labor contract signing process.Top-up Health Insurance for Employees after 1 year of employment contract signingAdditional Benefits: Longevity benefits, annual health check-up, bi-annual performance reviews, yearly travel and quarterly team-building activitiesCompany Clubs: Participation in company clubs such as Football Club, Game Club, Gym Club, Badminton Club, Media Club, etc.Gifts and Recognition: Gifts for Tet (Lunar New Year), company birthday, welcoming new employees, and other special occasions.Training and Development:Access to complimentary in-house training with experienced instructors.Support for external training programs.Policies that promote learning activities, knowledge exchange, and sharing.Working Hours: 5 days/week, Monday to FridayFlexible working hours: 8 hours/day, can start between 8:30 am and 9:00 am and end between 5:30 pm and 6:00 pm.",Newwave Solutions JSC,https://www.topcv.vn/brand/newwavesolutions?id=14514,https://www.topcv.vn/brand/newwavesolutions/tuyen-dung/middle-frontend-developer-angular-english-j1475544.html?ta_source=ITJobs_LinkDetail
Developer,,Trên 5 năm,,,,"Supervise, consult and define the solutions along with other seniors to solve the given problemsAnalyze, break down and estimate the assign workManage, monitor and report the progress to PM or other managersLead, inspire, mentor, and coach other developers in projects or within company to grow up their skills and knowledges as well as working attitudesEager to learn, practise and evaluate new technologies and trends then share with other people in projects and/or within the companyInvestigate and work out the solution for difficult, time-sensitive problems regardless of technologies/domains in projects and/or within the companyReassure best practices applied well in the software development project of the company to improve the overall quality and the overall performance","Education: Bachelor's degree in CS/Software Engineering (preferred)Programming:Strong C# (5+ years) & OOP conceptsDeep understanding of .NET stack (5+ years): C#, ASP.NET MVC/Core, EF/Core7+ years of experience in software developmentDatabases:Strong SQL Server (5+ years) & relational DB (MySQL/PostgreSQL) experienceNon-SQL experience (MongoDB/Cassandra, 1+ year)Frontend: Proficient in a popular framework (Angular/ReactJS/VueJS, 1+ year)Backend: Design & architect RESTful/gRPC/GraphQL APIsWeb Technologies: Strong in HTML5, CSS3, JavaScriptDevOps: Working knowledge of hosting environments and cloud platforms (CI/CD, Git)Soft Skills: Eager to learn, solve problems under pressure.Fluent in English (both oral & written)Optional Skills:Caching (Redis, MemCache, Couchbase).NET mobile development (Xamarin/MAUI)Testing methodologies (TDD, BDD, ATDD)SQL optimizationBuild tools (Webpack, BabelJS)Containerization (Docker, K8s)Microservices/Micro Frontends","1. Human Resource Development PolicyDeveloping a high-quality workforce is a top priority at Newwave Solutions. We, therefore, continuously build and refine policies to attract, nurture, and reward talented individuals. Our strategies include:Fostering a Strong Learning Culture: Newwave Solutions regularly conducts internal training programs and sends employees to reputable institutions to enhance both their professional and soft skills.Ensuring Employee Well-being and Rights: We implement regulations that ensure employee welfare and rights, fostering stronger bonds between employees and the company and creating an environment for focused work and dedication.Transparent and Equitable Compensation: We have established a transparent and equitable system for salary and bonuses.Promoting Well-being: We organize regular events to care for the physical and mental well-being of employees during holidays, festivals, birthdays, team-building activities, and summer trips.2. Advancement OpportunitiesBy joining Newwave Solutions, candidates can benefit from:A Youthful and Transparent Environment: We offer a youthful and transparent environment with clear paths for career advancement.Developing Personal and Professional Skills: We provide maximum opportunities to develop personal, collective, and work productivity capabilities.3. Compensation and BenefitsCompetitive Salary, up to 55M grossBonuses: 13th-month salary, performance-based bonuses tied to the company's business performance, individual capacity, etc.Full Salary During Probation: Employees receive 100% of their salary during the probationary period.Social and Health Insurance: Social insurance, health insurance, and unemployment insurance as regulated by the government. Social insurance payment is processed during the labor contract signing process.Top-up Health Insurance for Employees after 1 year of employment contract signingAdditional Benefits: Longevity benefits, annual health check-up, bi-annual performance reviews, yearly travel and quarterly team-building activitiesCompany Clubs: Participation in company clubs such as Football Club, Game Club, Gym Club, Badminton Club, Media Club, etc.Gifts and Recognition: Gifts for Tet (Lunar New Year), company birthday, welcoming new employees, and other special occasions.Training and Development:Access to complimentary in-house training with experienced instructors.Support for external training programs.Policies that promote learning activities, knowledge exchange, and sharing.Working Hours: 5 days/week, Monday to FridayFlexible working hours: 8 hours/day, can start between 8:30 am and 9:00 am and end between 5:30 pm and 6:00 pm.",Newwave Solutions JSC,https://www.topcv.vn/brand/newwavesolutions?id=14514,https://www.topcv.vn/brand/newwavesolutions/tuyen-dung/senior-net-developer-english-speaking-j1475532.html?ta_source=ITJobs_LinkDetail
Java Developer,,3 năm,,,,"Lập trình các ứng dụng Java Web, Restful API bằng framework Spring Boot, VueJSTham gia nghiên cứu, xây dựng phát triển hệ thống dựa trên đặc tả yêu cầu được cung cấp bởi KHTham gia đóng góp ý tưởng với Leader và KH nhằm cải thiện sản phẩm hoặc quy trình làm việcThực hiện các công việc phát sinh khác (nếu có) theo yêu cầu của Leader.","Thành thạo ngôn ngữ Java; có kinh nghiệm từ 3 năm làm việc với framework Spring Boot (Có kinh nghiệm về Java 8 trở lên)Có kinh nghiệm làm việc Frontend, từ 6 tháng kinh nghiệm (ưu tiên VueJS)Nắm vững về Java CoreCó hiểu biết tốt về Design pattern, OOP, REST API, Json, Restful, OauthCó hiểu biết và nhiều kĩ năng làm việc với MS SQL Server hoặc các CSDL tương tự khác như MySQL, PostgreSQL, ...Hiểu rõ mô hình MVCKỹ năng đọc hiểu tài liệu Tiếng AnhKỹ năng làm việc nhóm, khả năng chịu áp lựcCó kỹ năng tổ chức, quản lý công việc; tự nghiên cứu, xây dựng và quản lý tài liệu kỹ thuật.","1. Chính sách phát triển nhân lựcPhát triển nguồn nhân lực chất lượng cao là mục tiêu ưu tiên hàng đầu tại Newwave Solutions. Do đó, chúng tôi luôn không ngừng xây dựng và hoàn thiện những chính sách để thu hút, bồi dưỡng và đãi ngộ xứng đáng đối với nhân tài như:Với văn hóa học tập mạnh mẽ Newwave thường xuyên tổ chức các khóa đào tạo nội bộ hoặc gửi nhân sự đi đào tạo tại các cơ sở uy tín để giúp nhân sự nâng cao cả kỹ năng chuyên môn và kỹ năng mềmCó quy chế đảm bảo phúc lợi và quyền lợi cho nhân viên nhằm tăng sự gắn kết của nhân viên với công ty, tạo điều kiện cho nhân viên tập trung làm việc và cống hiếnCơ chế lương thưởng rõ ràng, đảm bảo tính minh bạch và công bằngĐịnh kỳ tổ chức các sự kiện chăm sóc đời sống vật chất lẫn tinh thần của nhân viên vào các dịp lễ, Tết hoặc sự kiện quan trọng (sinh nhật công ty, teambuilding, du lịch hè ...)2. Cơ hội thăng tiếnĐến với Newwave Solutions, ứng viên có cơ hội được:Làm việc trong môi trường trẻ, minh bạch với cơ hội thăng tiến rõ ràngĐược tạo điều kiện tối đa để phát triển năng lực cá nhân, tập thể và năng suất làm việc3. Chế độ đãi ngộLương thỏa thuận theo năng lực (up to 25M) Thưởng lương tháng 13, thưởng hiệu quả theo tình kinh doanh của công ty, thưởng đột xuất theo năng lực cá nhân, ...Thử việc 2 tháng: nhận 100% mức lươngĐược hưởng BHXH, BHYT, BHTN theo chế độ nhà nước ban hành.Bảo hiểm Sức khỏe cao cấp dành cho toàn bộ CBNV (sau khi ký HĐLĐ 1 năm)Chế độ thâm niênKhám sức khỏe 1 lần/nămReview performance: 2 lần/nămĐược tham gia các Câu lạc bộ của Công ty: CLB Bóng đá, các CLB Game, CLB Gym, CLB Cầu Lông, Media...Quà Tết, Quà sinh nhật công ty, Quà chào mừng nhân viên mới, Quà các dịp lễ ...Đặc biệt:Được tham gia các lớp học nội bộ miễn phí tại công ty với đội ngũ giảng viên dày dặn kinh nghiệm.Được hỗ trợ khi tham gia các khóa đào tạo bên ngoài.Chính sách hỗ trợ các hoạt động học tập, trao đổi, chia sẻ kiến thứcNgày làm việc: 5 ngày/tuần. Từ T2-T6, nghỉ T7, CN, Lễ Tết.Địa điểm làm việc: tòa Mitec, Dương Đình Nghệ, Yên Hòa, Cầu GiấyChấm công linh hoạt: 8 tiếng/ngày, có thể bắt đầu trong khoảng 8h30 - 9h00 và kết thúc trong khoảng 17h30 đến 18h00",Newwave Solutions JSC,https://www.topcv.vn/brand/newwavesolutions?id=14514,https://www.topcv.vn/brand/newwavesolutions/tuyen-dung/middle-java-developer-en-doc-hieu-j1475540.html?ta_source=ITJobs_LinkDetail
