title,level,experience,recruit_quantity,form_of_work,gender,describe,require,interest,company_name,company_link,job_link
Automation Test,Nhân viên,1 năm,1 người,Toàn thời gian,Không yêu cầu,"Được tham gia vào các dự án thực tế phần mềm của công ty với vai trò TesterLập kế hoạch test và kịch bản test, chuẩn bị dữ liệu test.Quản lý, phân tích kết quả test và báo cáo kết quả test.Phối hợp với các bộ phận khác của công ty để đảm bảo chất lượng dự án.Truyền đạt nội dung, hỗ trợ các thành viên dự ánKiểm thử chất lượng phần mềm, nghiệm thu sản phẩm trước khi thực hiện chuyển giao.","Hơn 1 năm kinh nghiệm với Automation TestCó kinh nghiệm xây dựng tài liệu phân tích thiết kế hệ thống, tài liệu đề xuất giải pháp dựa trên yêu cầu của khách hàng.Có kinh nghiệm làm việc với karate frameworkKiến thức và kinh nghiệm về các lập trình Java 1 trong các nền tảng Windows/Linux/Web sử dụng 1 trong các frame work: Srping Boot, Hibernate, Java Script, JSP/Serverlet (Optionals)Có kiến thức về hệ thống CSDL: MS SQL, OracleCó kiến thức về phân tích và triển khai ứng dụng trên web server: JBoss, TomcatCó kiến thức về mô hình ứng dụng MVC/ TierCó kinh nghiệm làm việc với ngân hàng là 1 lợi thế","Lương tháng 13Hỗ trợ đầy đủ trang thiết bị làm việc PC/ Laptop....Đóng bảo hiểm theo luật lao động Việt Nam (BHXH, BHYT, BHTN)12 ngày phép/ năm và Thưởng vào các dịp lễ khác trong năm (1/1, 30/4-1/5; 2/9, 8/3, 20/10...), Sinh nhật; Chi phí công đoàn thăm hỏi vào các dịp hiếu, hỉ, ốm đau;Làm việc thứ 2 đến thứ 6, Nghỉ Thứ 7, Chủ nhậtPhụ cấp gửi xe; Phụ cấp cơm trưa, ngoài ra phụ cấp điện thoại và đi lại tùy thuộc vào một số vị trí và cấp bậc;Khám sức khỏe định kỳ 1 lần/nămDu lịch nghỉ mát 1 lần/ năm.Tổ chức teambuilding định kỳ, tổ chức sinh nhật, team lunch, ...Happy hours hàng tháng, free snacks, hoa quả, đồ uống.Được đào tạo và trau dồi không chỉ kiến thức chuyên môn, kỹ năng mềm mà cả kỹ năng quản lý nhóm, quản lý dự án thông qua các buổi đào tạo nội bộ chung do phòng Đào tạo tổ chức hoặc các buổi đào tạo của riêng phòng ban;Môi trường làm việc chuyên nghiệp, trẻ trung, năng động, nhiều cơ hội thăng tiếnĐội ngũ kỹ sư, nhân viên tài năng, giàu kinh nghiệmLàm việc với tác đối tác lớnReview tăng lương định kỳ hàng năm (2 lần / năm)",Công ty TNHH Giải pháp Phân tích dữ liệu Insight Data,https://www.topcv.vn/cong-ty/cong-ty-tnhh-giai-phap-phan-tich-du-lieu-insight-data/110386.html,https://www.topcv.vn/viec-lam/automation-test/1466524.html?ta_source=ITJobs_LinkDetail
"Kỹ Sư
        Giải Pháp Mạng (Network Engineer)",Nhân viên,3 năm,1 người,Toàn thời gian,Không yêu cầu,"Đảm bảo hoạt động thông suốt cho hệ thống mạng LAN, WANTheo dõi, kiểm tra, vận hành, quản trị các thiết bị mạng (Router, Switch, Modem..), các đường truyền mạng leased-line, MPLS, P2P, ADSL,... băng thông mạng để phát hiện và xử lý các sự cố cũng như lỗi không làm ảnh hưởng tới hoạt động của công ty.- Duy trì tính khả dụng của hệ thống, quản lý issue trong hoạt động thường trực.- Tham gia nghiên cứu, ứng dụng các xu hướng công nghệ mới, giải pháp mới.Nghiên cứu, tìm hiểu/cập nhật và để xuất các vấn đề về hệ thống, phần mềm, chương trình máy tính... có liên quan đến hoạt động của Phòng/Trung tâm/Ngân hàng.Thực hiện các công việc/nhiệm vụ khác theo yêu cầu của Trưởng Phòng","Tốt nghiệp đại học trở lên chuyên ngành CNTT/ Toán tin/ Điện tử viễn thông/ Khoa học máy tính.Kiến thức về Routing, Switching, và Network Security, Load Balancing.Có hiểu biết về các hệ thống: Network DC, Network Service Provider, hệ thống Wifi, hệ thống mạng WAN, hệ thống mạng MAN, ...Có kinh nghiệm trong việc monitor và giám sát kênh truyền.Có kinh nghiệm cấu hình Firewall, VPN, ...Kiến thức cơ bản các thiết bị Cisco, Fortigate,...Có chứng chỉ CCNP, CCIE, ... là một lợi thế","(-) Thu nhập: upto 30.000.000 vnđ/ tháng. (-) Cơ hội phát triển bản thân:Làm việc với đội ngũ kỹ sư, nhân viên năng động, giàu nhiệt huyết, đam mê, lý tưởng lớn Được lắng nghe, tôn trọng ý kiến, quan điểm cá nhân để trao đổi thẳng thắn, chia sẻ cùng phát triển;Được lãnh đạo giàu kinh nghiệm đào tạo, định hướng con đường nghề nghiệp rõ ràng;Được cử tham gia các khóa đào tạo mới, đào tạo nâng cao phù hợp với năng lực và nguyện vọng;Được ghi nhận những đóng góp, nỗ lực kịp thời, chính xác.(-) Phúc lợi:Thưởng dự án, thưởng tháng lương thứ 13, thưởng lễ tết;Hỗ trợ ăn trưa tại công ty;Phụ cấp trang phục hàng năm;Được công ty thực hiện đầy đủ nghĩa vụ về BHXH, BHYT, BHTN theo quy định của Nhà nước, thai sản, cưới hỏi, sinh nhật,...",CÔNG TY TNHH THƯƠNG MẠI VÀ DỊCH VỤ CÔNG NGHỆ MSS,https://www.topcv.vn/cong-ty/cong-ty-tnhh-thuong-mai-va-dich-vu-cong-nghe-mss/87502.html,https://www.topcv.vn/viec-lam/ky-su-giai-phap-mang-network-engineer/1465151.html?ta_source=ITJobs_LinkDetail
Chuyên Viên Phân Tích Nghiệp Vụ,Nhân viên,3 năm,1 người,Toàn thời gian,Không yêu cầu,"Tham gia vào các dự án phần mềm ứng dụng trong lĩnh vực bảo hiểm, kế toán tài chính, ngân hàng với nhiệm vụ: Lập kế hoạch khảo sát, thu thập thông tin khảo sát từ phía khách hàngPhân tích yêu cầu nghiệp vụ và viết các đặc tả yêu cầu người sử dụngXây dựng kịch bản và thực hiện kiểm thử ứng dụngXây dựng các tài liệu và thực hiện đào tạo, triển khai, hỗ trợ khách hàngPhối hợp kỹ thuật trong quá trình triển khai dự ánThực hiện Báo cáo theo quy định và theo yêu cầu (nếu có)","1.Kiến thứcTốt nghiệp Đại học các chuyên ngành Kinh tế, Tài chính, Ngân hàng, CNTTHiểu biết về nghiệp vụ Kinh tế như Kế toán Tài chính, Kế toán Ngân sách, Hành chính công.Hiểu biết về lĩnh vực hoạt động của khách hàng, nhu cầu của khách hàng.2.Kỹ năngKỹ năng viết tài liệu, mô hình và tổng quát hóa các vấn đềKỹ năng làm việc độc lậpKỹ năng giao tiếp, làm việc nhóm và giải quyết vấn đềViết, giao tiếp Tiếng Anh cơ bảnBiết sử dụng MS Office và một số công cụ phục vụ công việc như axure, …3.Kinh nghiệmTừ 03 năm trở lên với vị trí phân tích nghiệp vụ các dự án xây dựng phát triển phần mềm Khối Chính phủ (các dự án sử dụng vốn ngân sách nhà nước).","Chế độ nghỉ mát hàng năm, nghỉ phép theo quy định.Tham gia BHXH, BHYT, BHTN, Công đoàn,...Hỗ trợ 100% chi phí đào tạo, thi chứng chỉ phục vụ công việc.Hỗ trợ đến 70% chi phí mua máy tính cá nhân cho NLĐ với thời gian công tác từ 1 năm trở lên.Các chương trình văn hóa tổ chức thường niên,...Đội ngũ lãnh đạo, quản lý trọng nhân tài, giúp nhân viên phát huy tối đa năng lực.Môi trường làm việc thân thiện, khuyến khích sáng tạo và thể hiện chính kiến.Khám sức khỏe định kỳ",Công ty Cổ phần Tập đoàn HiPT,https://www.topcv.vn/cong-ty/cong-ty-co-phan-tap-doan-hipt/4247.html,https://www.topcv.vn/viec-lam/chuyen-vien-phan-tich-nghiep-vu/74063.html?ta_source=ITJobs_LinkDetail
"Lập Trình Viên
        Fullstack(PHP/Golang/Javascript)",Nhân viên,2 năm,3 người,Toàn thời gian,Không yêu cầu,"Phát triển và tối ưu hệ thống thanh toán cho hàng trăm nghìn điểm chấp nhận thanh toán.Thiết kế, phát triển các ứng dụng backend sử dụng Golang, PHP với các framework như Gin, Echo, Gorm, Yii2.Xây dựng và phát triển giao diện frontend sử dụng PHP (Yii2) JavaScript (Vue.js) đảm bảo tính trực quan, dễ sử dụng.Tối ưu hóa hiệu suất hệ thống, đảm bảo khả năng mở rộng và bảo mật của hệ thống thanh toán.Làm việc với cơ sở dữ liệu MySQL, MongoDB để quản lý dữ liệu người dùng và giao dịch.Quản lý mã nguồn và làm việc nhóm thông qua Git.Tích hợp các cổng thanh toánXây dựng và triển khai hệ thống trong môi trường Docker, Kubernetes (K8s) để đảm bảo hệ thống hoạt động ổn định và dễ mở rộng.Sử dụng ChatGPT như một công cụ hỗ trợ để tăng cường năng suất, tìm kiếm giải pháp nhanh chóng và tối ưu hóa quy trình phát triển.Tham gia phân tích yêu cầu, thiết kế giải pháp kỹ thuật và lập kế hoạch phát triển.","Kỹ năng chuyên môn:Thành thạo ít nhất một trong các ngôn ngữ lập trình: Golang, PHP, JavaScript.Có kinh nghiệm với các framework Gin, Echo, Gorm, Yii2, Vue.js là một lợi thế.Có kinh nghiệm làm việc với cơ sở dữ liệu MySQL, MongoDB, và các công cụ như Redis.Hiểu biết về các hệ thống CMS và nền tảng mã nguồn mở như WordPress, Magento, Shopify, Prestashop.Kinh nghiệm làm việc với hệ thống thanh toán là một lợi thế lớn.Hiểu biết về RESTful API, WebSocket và các giao thức truyền tải dữ liệu.Kinh nghiệm triển khai ứng dụng trong môi trường Docker và Kubernetes (K8s).Thành thạo trong việc sử dụng Git để quản lý mã nguồn và làm việc nhóm.Khả năng sử dụng ChatGPT để hỗ trợ tìm kiếm giải pháp kỹ thuật, viết mã và tối ưu hóa quy trình làm việc.Kỹ năng mềm:Có khả năng làm việc nhóm tốt, tương tác hiệu quả với các phòng ban khác.Tinh thần học hỏi và tiếp cận với các công nghệ mới.Có khả năng phân tích và giải quyết vấn đề.","Mức lương cạnh tranh, thưởng dựa trên năng lực và hiệu quả công việc.Cơ hội làm việc với các dự án lớn, công nghệ tiên tiến trong lĩnh vực thanh toán.Được tham gia vào môi trường làm việc sáng tạo, năng động và cởi mở.Cơ hội thăng tiến trong sự nghiệp, đào tạo và phát triển kỹ năng chuyên môn.Đầy đủ các chế độ bảo hiểm, nghỉ phép và các quyền lợi khác theo luật lao động.",CÔNG TY CỔ PHẦN CÔNG NGHỆ VI MÔ,https://www.topcv.vn/cong-ty/cong-ty-co-phan-cong-nghe-vi-mo/38023.html,https://www.topcv.vn/viec-lam/lap-trinh-vien-fullstackphp-golang-javascript/1464323.html?ta_source=ITJobs_LinkDetail
"Chuyên Viên Digital Marketing
        (SEO)",Nhân viên,2 năm,1 người,Toàn thời gian,Không yêu cầu,"Tìm hiểu và phân tích sản phẩm/ dịch vụ của công ty, đối thủ và hành vi người dùng để xây dựng kế hoạch, chiến lược SEO.Tối ưu SEO (Onpage & Offpage); Website và mobile, Social...Nghiên cứu và xây dựng bộ từ khóa SEO cho sản phẩm, dịch vụ của công ty.Chịu trách nhiệm quản lý, giám sát và thực hiện nội dung chuẩn SEO cho website.Lên kế hoạch và triển khai link building cho sản phẩm/ dịch vụ của công ty.Thống kê, tối ưu và báo cáo hiệu quả SEO.Quản lý và vận hành các công cụ theo dõi và phân tích website (Google Analytics, Webmaster; Ahrefs, SEMrush...).Khả năng viết nội dung SEO đa nền tảng.Các công việc khác theo yêu cầu của cấp trên.","Tốt nghiệp Cao đẳng/Đại học trở lên, chuyên ngành marketing hoặc các ngành liên quan. Ít nhất 2 năm kinh nghiệm trong lĩnh vực Digital Marketing, đặc biệt là SEO Onpage - OffpageCó kinh nghiệm thực hiện về lĩnh vực công nghệ, ứng dụng.Thành thạo các công cụ theo dõi, phân tích website, SEO...KỹCó khả năng giao tiếp tốt, có trách nhiệm và tinh thần hợp tác nhóm.Tích cực chủ động trong công việc.Biết sử dụng các tool và AI là một lợi thế","Mức lương: 12,000,000 - 15,000,000 VND/thángPhụ cấp ăn trưa, chuyên cần, phí gửi xeTham gia đầy đủ chế độ Bảo hiểm theo Pháp luật quy địnhNghỉ lễ theo qui định, thử việc có phép năm, 12 ngày/nămThưởng lễ/trái cây hàng tuần/đồ ăn nhẹ hàng ngày/tiệc công ty/teambuilding",CÔNG TY TNHH PHÁT TRIỂN VĂN HÓA CÔNG NGHỆ INTERNET ATG,https://www.topcv.vn/cong-ty/cong-ty-tnhh-phat-trien-van-hoa-cong-nghe-internet-atg/165069.html,https://www.topcv.vn/viec-lam/chuyen-vien-digital-marketing-seo/1465828.html?ta_source=ITJobs_LinkDetail
"IT
        Audit And Risk Assessment Specialist (Senior)",Nhân viên,Trên 5 năm,2 người,Toàn thời gian,Không yêu cầu,"ABOUT THE JOBLead the overall technical assurance definition and execution of the Technology Assurance framework and programsProvide expertise level guidance on compliance requirements related to technology for control/process documentation, testing, and issue managementCollaborate with Group InfoSec Governance to assess critical and key gaps against standards and regulatory requirements related to technologyManage the Technology assessment at an expert level and evaluate and advise on the overall design and effectiveness of all key technology controls throughout the business cycleContribute to defining, developing, and maintaining technology assurance framework in all markets in accordance with the Group Technology RoadmapAccountable for planning, managing, and executing day-to-day activities of Technology related audit engagementsCollaborate with key technology, business, risk, audit, and compliance teams to identify, evaluate, and address critical technology-related risksProactively research industry trends and define, influence, and implement appropriate technology-related KRIs, metrics, and solutionsEnsure readiness for IT Security Internal/External audits and advise BUs on Technology risk assessment.","ABOUT YOUBachelor’s degree in information technology, computer science, or a related field5+ years of experience in IT Audit and Risk AssessmentIndustry recognized certification such as CGEIT, CISSP, CISM, CISA, ISO 27001, CRISC, PCI DSS, etc.Excellent stakeholder management and communication skillsGood command of spoken and written EnglishSolid understanding of current and emerging technologiesDetailed oriented and able to work under pressure and accustomed to working under tight deadlinesTeam-oriented, collaborative, diplomatic, and flexibleStrong written and verbal communication skills, strong effectiveness across business units.","Benefits13th-month salary14+ annual leaves per yearPremium healthcare insurance, starting from your probation periodProject reviews and yearly performance appraisalsAnnual company tripsTeambuilding activities: Team lunch/dinner, events, and celebrations, sports clubs (football, yoga, badminton, etc.)International team with flexible working time + hybrid workingTailor-made career pathTechnical workshops and training coursesMobility: Opportunities to be on-site abroad in our offices in over 60+ countriesEqual OpportunityAmaris Consulting is proud to be an equal-opportunity workplace. We are committed to promoting diversity within the workforce and creating an inclusive working environment. For this purpose, we welcome applications from all qualified candidates, regardless of gender, sexual orientation, race, ethnicity, beliefs, age, marital status, disability, or other characteristics.",CÔNG TY TNHH AMARIS VIỆT NAM,https://www.topcv.vn/cong-ty/cong-ty-tnhh-amaris-viet-nam/103852.html,https://www.topcv.vn/viec-lam/it-audit-and-risk-assessment-specialist-senior/1466513.html?ta_source=ITJobs_LinkDetail
"Thực Tập Sinh
        
            Lập Trình PHP",Thực tập sinh,Dưới 1 năm,4 người,Thực tập,Nam,"- Học các công cụ, framework mà công ty đang sử dụng- Xây dựng, chỉnh sửa giao diện HTML, CSS, Javascript- Cập nhật các tính năng của website bằng Laravel- Tìm hiểu, tra cứu tài liệu trên internet để xử lý công việc- Cụ thể trao đổi khi phỏng vấn","● Đam mê tìm hiểu về các công nghệ lập trình.● Vừa tốt nghiệp hoặc sinh viên năm cuối đang trong kì đồ án các trường cao đẳng, đại học,....● Chăm chỉ, có khả năng tự nghiên cứu, giao tiếp tốt.Có kinh nghiệm làm việc với: HTML, CSS, SASS, PHP, Javascript● Biết về chuẩn BEM, PSR coding convention● Sử dụng thành thạo: Laravel, Bootstrap● Có kiến thức về OOP, MVC● Có kinh nghiệm làm việc với: Git, Git bash, VSCode Git Extension● Sử dụng thành thạo VSCode, Sublime Text● Ưu tiên ứng viên biết về: Angular, React● Chăm chỉ, kiên trì, cẩn thận trong công việc● Đam mê, có tinh thần cầu tiến● Có khả năng tự học● Ưu tiên ứng viên biết tiếng Anh","● Công việc năng động, sáng tạo, được học hỏi kinh nghiệm trong các dự án thực tế với các dự án hiện đại, đa dạng của nước ngoài.● Môi trường làm việc thân thiện, văn minh, chuyên nghiệp.● Được làm việc theo quy trình chuyên nghiệp, theo mô hình Agile● Cơ hội nâng cao trình độ ngoại ngữ và kỹ năng phát triển nghề nghiệp, có nhiều cơ hội thăng tiến trong công việc.● Các chế độ phúc lợi, chế độ bảo hiểm theo quy định của Công ty và pháp luật Nhà nước sau khi trở thành nhân viên chính thức của công ty.● Thời gian thực tập có thể rút ngắn tùy năng lực của bạn. Cơ hội lên chính thức và deal lương sau quá trình thực tập.",CÔNG TY CỔ PHẦN DỊCH VỤ TRUYỀN THÔNG ĐA PHƯƠNG TIỆN VIỆT NAM,https://www.topcv.vn/cong-ty/cong-ty-co-phan-dich-vu-truyen-thong-da-phuong-tien-viet-nam/118194.html,https://www.topcv.vn/viec-lam/thuc-tap-sinh-lap-trinh-php/841016.html?ta_source=ITJobs_LinkDetail
"Thực Tập Sinh
        
            Lập Trình Viên JavaScript",Thực tập sinh,Dưới 1 năm,4 người,Thực tập,Nam,"● Sử dụng Javascript tham gia phát triển các website, ứng dụng mobile. ● Làm việc, phối hợp công việc theo nhóm dưới sự phân công công việc của quản lý  dự án.● Chi tiết trao đổi khi phỏng vấn","●  Định hướng fullstack Nestjs + Angular●Tư duy lập trình, tư duy logic hệ thống ● Ham học hỏi & có khả năng thích nghi với Ngôn ngữ lập trình và Công nghệ mới● Tinh thần tự giác, làm việc cẩn thận, trách nhiệm ● Có kiến thức về HTML/CSS ● Có kiến thức về Javascript, NodeJS ● Có hiểu biết về thiết kế cơ sở dữ liệu: MySQL, Postgres, MongoDB, ... ● Có hiểu biết về OOP, MVC, Design patternƯu tiên: ● Ưu tiên sinh viên năm cuối hoặc mới tốt nghiệp. ● Ưu tiên ứng viên đã từng sử dụng các thư viện hoặc framework liên quan đến javascript: Node.js, ExpressJS, Angular, React, Vuejs, React-native,...","● Có mức hỗ trợ thực tập + thưởng Lễ, Tết,... ● Lộ trình thăng tiến rõ ràng, cơ hội lên làm nhân viên chính thức.  Môi trường năng động, sáng tạo, được leader giỏi chỉ dẫn, được làm việc với các  dự án hiện đại, đa dạng của nước ngoài.  ● Quy trình chuẩn mực theo tiêu chuẩn Agile. ● Các chế độ phúc lợi, chế độ bảo hiểm theo quy định của Công ty và pháp luật Nhà  nước khi trở thành nhân viên chính thức ● Đồng nghiệp thân thiện, được tham gia các hoạt động của công ty: team building,  happy hour,...",CÔNG TY CỔ PHẦN DỊCH VỤ TRUYỀN THÔNG ĐA PHƯƠNG TIỆN VIỆT NAM,https://www.topcv.vn/cong-ty/cong-ty-co-phan-dich-vu-truyen-thong-da-phuong-tien-viet-nam/118194.html,https://www.topcv.vn/viec-lam/thuc-tap-sinh-lap-trinh-vien-javascript/840991.html?ta_source=ITJobs_LinkDetail
Senior JAVA Developer,Nhân viên,3 năm,3 người,Toàn thời gian,Không yêu cầu,"Tham gia các dự án sử dụng ngôn ngữ lập trình JAVA    Phát triển phần mềm theo tài liệu được cung cấp.    Viết tài liệu kỹ thuật, tài liệu thiết kế hệ thống,…    Báo cáo tiến độ, chủ động đưa phương án xử lý khi gặp vấn đề & báo cáo với quản lý trực tiếp.    Tìm hiểu công nghệ mới để hỗ trợ dự án nếu cần.    Review, support, training dev mới.","Tốt nghiệp Đại học trong và ngoài nước chuyên ngành công nghệ thông tin hoặc các ngành liên quan Tối thiểu 3,5 năm kinh nghiệm phát triển phần mềm với Java Application/Web/API, có kiến thức về Java 8 trở lên, hiểu biết sâu về một số framework Java phổ biến.Sử dụng thành thạo công cụ Git, svn, Eclipse, IntellijCó thể làm việc tốt với một trong các hệ quản trị cơ sở dữ liệu thông dụng như: MySQL, SQL Server, Oracle, Sqlite, PostgreSQL,... Có kiến thức chuyên sâu về Function, ProceduceCloud: Có kinh nghiệm sử dụng các dịch vụ của AWS như EC2, RDS, S3, Cognito, SendGridCó kinh nghiệm, phát triển front-end với 1 số framework phổ biến như ReactJs, VueJs, AngularJs, JS, CSS, HTML, thiết kế hệ thống, kiến trúc và giải pháp kỹ thuật.Có kiến thức về Design Pattern, nguyên tắc SOLID, kỹ năng Clean Code.Năng động, sáng tạo, có khả năng tự nghiên cứu. Có tinh thần trách nhiệm và khả năng làm việc độc lập hoặc theo nhóm.Ưu tiên có kinh nghiệm ở vị trí Technical Leader/ Team Leader hoặc tương đương.Ưu tiên có kinh nghiệm về CI/CD, Docker, Jenkin, Microservice, điện toán đám mây.Ưu tiên ứng viên biết tiếng Nhật (có bằng JLPT N3 trở lên).","Thu nhập: Thỏa thuận theo năng lực (up to 60tr)Xét tăng lương 1 lần/năm, mức thu nhập gia tăng theo năng suất và hiệu quả công việc, đóng góp thực tế vào dự án của công tyThưởng cuối năm, thưởng sinh nhật và thưởng các ngày lễ khác.Lộ trình thăng tiến rõ ràng và làm việc với các chuyên gia Nhật Bản (có cơ hội được làm việc onsite tại Nhật)Được tham gia vào các buổi đào tạo, seminar hàng tháng để nâng cao kỹ năng công việc và cùng nhau chia sẻ: knowledge base, working experience, lessons learned, best practices...Các chế độ theo quy định của pháp luật và phúc lợi đãi ngộ của công ty: BHXH, hiếu hỉ, ốm đau...Chế độ lương làm thêm giờ (OT) theo đúng quy định của pháp luậtĐược tham gia vào các hoạt động teambuilding, du lịch thường niên, sinh nhật, .Tham gia vào câu lạc bộ thể thao: cầu lông, bóng đá,...Được trau dồi và phát triển kỹ năng ngoại ngữ: câu lạc bộ tiếng Nhật miễn phí.Thời gian làm việc: từ thứ 2 đến thứ 6 (Nghỉ thứ 7, CN)Môi trường làm việc trẻ và năng động, tôn trọng phát triển cá nhân, công bằng và luôn khuyến khích sáng tạo để phát huy tối đa năng lực.",CÔNG TY TNHH KỸ SƯ CÔNG NGHỆ CAO VN,https://www.topcv.vn/cong-ty/cong-ty-tnhh-ky-su-cong-nghe-cao-vn/6864.html,https://www.topcv.vn/viec-lam/senior-java-developer/1308594.html?ta_source=ITJobs_LinkDetail
