title,level,experience,recruit_quantity,form_of_work,gender,describe,require,interest,company_name,company_link,job_link
"Nhân Viên Tester
        (Manual/Automation)",Nhân viên,1 năm,1 người,Toàn thời gian,Không yêu cầu,"Lập Kế Hoạch Kiểm Thử:Hợp tác với các quản lý dự án và các bên liên quan khác để phát triển các kế hoạch kiểm thử toàn diện.Đảm bảo các nỗ lực kiểm thử được ước lượng chính xác và tích hợp vào thời gian biểu dự án.Thiết Kế và Thực Hiện Test Case:Phụ trách phân tích và kiểm tra các luồng chức năng nghiệp vụ và tính năng các sản phẩm phần mềmThiết kế và thực hiện kịch bản test.Thực hiện test tích hợp, test API, test Database, truy vấn SQL nhằm đảm bảo mục đích chất lượng cho dự ánXây dựng và duy trì các test case dựa trên thiết kế UI/UX, logic của frontend và backend.Theo Dõi và Báo Cáo Lỗi:Xác định, ghi lại và theo dõi các lỗi phần mềm bằng các công cụ thích hợp.Giao tiếp rõ ràng các vấn đề và làm việc với đội dev để giải quyết lỗi.Theo dõi và đảm bảo chất lượng sản phẩm trong suốt quá trình phát triển.Hợp Tác và Giao Tiếp:Làm việc liên chức năng với các nhóm phát triển, thiết kế và sản phẩm để hiểu rõ yêu cầu và đảm bảo chất lượng sản phẩm.Đưa ra phản hồi và gợi ý để cải thiện tính sử dụng và chức năng của sản phẩm.","Tối thiểu 1 năm kinh nghiệm về manunal test, có kinh nghiệm Automation Test là một lợi thếCó kinh nghiệm test API, test DatabaseCó kinh nghiệm design test case, test plan và làm tài liệu testCó kinh nghiệm phân tích và làm rõ yêu cầu từ dự ánƯu tiên ứng viên có kinh nghiệm làm việc trong lĩnh vực phần mềm, công nghệ, quảng cáo.Chú ý đến chi tiết, có tư duy logic và khả năng quan sát tốt.Có khả năng phân tích và hiểu rõ yêu cầu sản phẩm, vẽ được test case từ luồng thiết kế, frontend và backend.Ưu tiên có kiến thức về bảo mật (Security Testing), đặc biệt là kiểm tra các lỗ hổng bảo mật trong ứng dụng.","Mức lương: 10.000.000 - 16.000.000 VND - tùy theo năng lực ứng viênMôi trường làm việc: Bạn sẽ làm việc trong một môi trường năng động, chuyên nghiệp, thân thiện và đoàn kết, với nhiều cơ hội để sáng tạo, học hỏi và thăng tiến.Nghỉ phép: 12 ngày nghỉ phép hàng năm.Phúc lợi: Thưởng các dịp Lễ, Tết, sinh nhật, và các sự kiện thăm hỏi khác.Hoạt động đoàn thể: Tổ chức liên hoan, du lịch và teambuilding hàng năm.Cơ sở vật chất: Cơ sở hạ tầng đầy đủ và trang thiết bị hiện đại phục vụ công việc.Tại sao bạn nên chọn SMIT?Bạn sẽ được cùng làm việc với những người đồng nghiệp vui vẻ, thân thiện, thoải mái và sáng tạo.Chúng tôi là một start-up, nơi mà ý kiến và đóng góp của bạn không chỉ được hoan nghênh mà còn được coi trọng. Ở đây, rào cản giữa các bộ phận rất nhỏ , mọi người có thể tự do trao đổi ý kiến, cùng nhau hợp tác để đưa ra những giải pháp sáng tạo và hiệu quả nhất.Ngoài ra, chúng tôi cung cấp một môi trường làm việc linh hoạt và thoải mái, nơi mà bạn có thể tự do biểu đạt bản thân, đóng góp những ý tưởng táo bạo & thú vị và tạo ra ảnh hưởng tích cực.",CÔNG TY CỔ PHẦN GIẢI PHÁP CÔNG NGHỆ SMIT,https://www.topcv.vn/cong-ty/cong-ty-co-phan-giai-phap-cong-nghe-smit/174233.html,https://www.topcv.vn/viec-lam/nhan-vien-tester-manual-automation/1439057.html?ta_source=ITJobs_LinkDetail
Python Developer,Nhân viên,3 năm,2 người,Toàn thời gian,Không yêu cầu,"Tìm hiểu phân tích yêu cầu, nghiên cứu các kỹ thuật công nghệ mớiReview code và quản lý source code các dự án sản phẩm tập đoànThiết kế và phát triển các module phần mềm trong các dự án phần mềm trên web, ứng dụng,mobile, duy trì hoạt động ổn định và ngày càng tối ưu hơnTối ưu hiệu năng hệ thốngThực hiện nâng cấp phần mềm theo yêu cầuThực hiện các công việc khác liên quan đến bảo vệ, bảo mật dữ liệu của sản phẩmLàm việc theo sự phân công của trưởng nhóm/quản lý dự án, phối hợp giữa các nhóm để pháttriển sản phẩm","Thành thạo ngôn ngữ lập trình Python (từ 03 năm kinh nghiệm)Có kinh nghiệm làm việc với các framework: Flask, Django...Có kinh nghiệm sử dụng các loại database sau: MongoDB, MySQL, Redis...Có kiến thức chuyên môn sâu về nguyên lý hệ điều hành và kiến trúc máy tính; cấu trúc dữ liệuvà giải thuậtCó kiến thức về phân tích thiết kế hệ thống, software design pattern, an toàn thông tinCó khả năng đọc/viết tài liệu kỹ thuật bằng tiếng AnhƯu tiên:Có kiến thức cơ bản về lập trình Frontend (Javascript, HTML, CSS), định hướng trở thành Fullstack DeveloperCó kiến thức cơ bản về Kubernetes, MicroserviceCó kiến thức về tối ưu hiệu suất phần mềm, tối ưu đọc ghi dữ liệu","1. Chế độ lương, thưởng, thu nhập:Thu nhập: Thỏa thuậnPhúc lợi: Lương tháng 13, thưởng Bonus, Hỗ trợ ăn trưa, điện thoại, nghỉ mátThưởng ngày lễ và các ngày chỉ có ở Viettel như Ngày Sáng Tạo - 1/6, 22/12, quà Tết Dương, Tết Âm tri ân Gia đình, người sinh thành.Nghỉ phép năm: 16 ngày/nămĐược đóng đầy đủ về các chế độ bảo hiểm xã hội, bảo hiểm y tế, bảo hiểm thất nghiệp và các gói bảo hiểm sức khỏe khác.Bảo hiểm Pijico đóng free khi lên nhân viên chính thứcHàng năm CBNV được tham gia khám sức khỏe định kỳ tại các bệnh viện lớn2. Môi trường làm việcĐược làm việc trong Tập đoàn toàn cầu, tiên phong thực hiện sứ mệnh kiến tạo xã hội số.Môi trường mở, trẻ trung, năng động, trân trọng, yêu thương, tương hỗ & lắng nghe mỗi người từ những ý tưởng nhỏ nhất.Không gian làm việc xanh, mở, hiện đại.3. Cơ hội phát triển bản thânCó cơ hội thử sức trong lĩnh vực công nghệ tiên tiến, hiện đại nhất.Được thử sức với các dự án hấp dẫn, thử thách đủ lớn trong và ngoài nước để trưởng thành.Được trao quyền sáng tạo với đam mê của tuổi trẻ.Cơ hội học hỏi từ các chuyên gia hàng đầu, lãnh đạo và đồng nghiệp ưu tú.Cơ hội được đào tạo, trau dồi kĩ năng, chuyên môn để phát triển toàn diện.4.Địa điểm làm việcViettel Software: Tầng 4 & 5, Tòa nhà Thành Công, 80 Dịch Vọng Hậu, Cầu Giấy, Hà NộiThời gian làm việc: Từ thứ 2 đến thứ 6, nghỉ T7 & CN",Viettel Software,https://www.topcv.vn/cong-ty/viettel-software/153463.html,https://www.topcv.vn/viec-lam/python-developer/1475099.html?ta_source=ITJobs_LinkDetail
Lập Trình Viên IOS,Nhân viên,1 năm,1 người,Toàn thời gian,Không yêu cầu,"Cùng leader, tham gia phát triển các dự án mobile iOSTham gia ở tất cả các công đoạn của sản phẩm: Design, Code, Test, Review, ReleaseĐảm bảo hoàn thành kịp thời và chính xác các nhiệm vụ được giaoHỗ trợ leader và các thành viên khác trong việc tiếp cận các giải pháp, công nghệ mới","1-2 năm kinh nghiệm lập trình iOSCode thành thạo SwiftThành thạo Auto Layout và SwiftUISử dụng thành thạo GitCó kinh nghiệm về kết nối API và các kiến thức về RESTful, JSONCó kinh nghiệm về tích hợp Firebase, Admob, Subscription và In-app purchaseKhả năng nghiên cứu, ứng dụng công nghệ mới.Chịu được áp lực cao trong công việc, có khả năng làm việc độc lập, chủ động giải quyết vấn đề để hoàn thành nhiệm vụ.Khả năng đọc và tìm hiểu tài liệu tiếng anh.","Mức lương : 9.000.000 - 12.000.000VNĐ/tháng● Đánh giá năng suất và xét tăng lương 1 lần/năm●  Thưởng KPI, thưởng lễ tết ●  BHXH, nghỉ lễ theo quy định.● Môi trường làm việc trẻ, năng động, vui vẻ, hạnh phúc với các hoạt động văn hóa sôi động như picnic, team building, happy event, ...● Được làm nhiều, được thử nhiều và được sai, học thực chiến trong công việc",CÔNG TY CỔ PHẦN IMOBI,https://www.topcv.vn/cong-ty/cong-ty-co-phan-imobi/119303.html,https://www.topcv.vn/viec-lam/lap-trinh-vien-ios/949045.html?ta_source=ITJobs_LinkDetail
Kỹ Thuật Máy In,Nhân viên,Không yêu cầu kinh nghiệm,1 người,Toàn thời gian,Không yêu cầu,"- Sửa chữa các lỗi phần cơ điện, cài đặt kết nối các chức năng của máy in/fax/scan/photo- Bảo trì, bảo dưỡng các loại máy in/fax/scan/ photo- Trao đổi thêm khi phỏng vấn","- Yêu cầu: Nam giới- Không yêu cầu về bằng cấp- Có sức khỏe tốt.- Có tư duy logic, có khả năng làm việc độc lập và chịu áp lực công việc- Ưu tiên ứng viên có kinh nghiệm và sử dụng máy tính thành thạo","Thu nhập hấp dẫn theo năng lực và hiệu quảTham gia BHXH, Công đoànPhụ cấp xăng xe, điện thoại",CÔNG TY CP THƯƠNG MẠI HỒNG HÀ,https://www.topcv.vn/cong-ty/cong-ty-cp-thuong-mai-hong-ha/192250.html,https://www.topcv.vn/viec-lam/ky-thuat-may-in/1474894.html?ta_source=ITJobs_LinkDetail
"Business Analyst
        
            CRM",Nhân viên,2 năm,1 người,Toàn thời gian,Không yêu cầu,"Scope công việc: 70% làm việc về các dự án CRM & 30% BA cho các sản phẩm Cloud ComputingHướng tới việc trở thành Product Owner của 1 hoặc nhiều sản phẩm trong hệ sinh thái của Bizfly Cloud.Làm việc trong môi trường năng động, có đội ngũ Tech giàu kinh nghiệm trong lĩnh vực công nghệ điện toán đám mây.Xây dựng Mockup các sản phẩm mới và các tính năng cũ.Xây dựng bộ tài liệu để chuyển giao thông tin qua lại giữa các bộ phận kinh doanh, Dev và Tester.","Từ 2 năm kinh nghiệm làm việc ở vị trí BATừng làm việc với các dự án CRM hoặc mảng Cloud computing là một lợi thếCó tư duy logic, có khả năng sắp xếp và tổng hợp thông tin một cách có hệ thống.Có kỹ năng trình bày tốt.Có kinh nghiệm mô hình hóa hệ thống thông qua: Activity diagram, Data flow diagram, State Machine Diagram, Use case diagram, ...Biết sử dụng các công cụ phục vụ cho việc design, trình bày, documentation như: Axure, Balsamiq, Microsoft Office, ...","Thưởng đạt, vượt chỉ tiêu KPI/Thưởng năng suất: Xét thưởng áp dụng khi nhân viên đạt chỉ tiêu KPI cá nhân và hoặc tùy thuộc vào tình hình kết quả kinh doanh của công ty. Thưởng tháng lương 13 (thưởng Tết Âm Lịch): Xét thưởng định kỳ cuối năm căn cứ theo quy định của công ty và tùy thuộc vào tình hình kết quả kinh doanh của công ty.Thưởng thâm niên: Xét thưởng định kỳ cuối năm căn cứ theo thâm niên làm việc của nhân viên theo quy định của công ty và hoặc tùy thuộc vào tình hình kết quả kinh doanh của công ty.Thưởng Nóng, Thưởng thành tích vượt trội: Khi có thành tích xuất sắc và hoặc dự án thành công...     Thưởng vinh danh, tôn vinh: Bình chọn giải cá nhân/bộ phận xuất sắc cấp Công ty định kỳ hàng năm.     Thưởng Tự Khoe cấp Bộ Phận: Khuyến khích CBNV, các bộ phận thi đua hoàn thành tốt các mục tiêu công việc, kích thích đổi mới, sáng tạo trong công việc; ghi nhận, động viên kịp thời các việc hay, sáng kiến hiệu quả của các các nhân, tập thể. Mức thưởng tự khoe, tự đề xuất theo quy chế và ngân sách của công ty cấp cho từng bộ phận.   ĐIỀU CHỈNH LƯƠNG:Xem xét điều chỉnh lương khi cần thiết trong quá trình làm việc hoặc khi có thành tích vượt trội (không giới hạn số lần tăng lương trong năm). Các tiêu chí xét điều chỉnh lương: Thời gian làm việc thực tếKết quả đánh giá hiệu quả công việc của cá nhân và bộ phận theo KPINăng lực/đóng góp của bản thânCÁC CHẾ ĐỘ PHÚC LỢI:Môi trường và điều kiện làm việc:Trang thiết bị làm việc công nghệ cao, phong phú, đa dạng.Văn phòng làm việc hiện đại, chuyên nghiệp, an toàn.Môi trường làm việc thực tế, năng động và được tham gia các khóa đào tạo trực tiếp bởi các chuyên gia, đội ngũ kỹ thuật giàu kinh nghiệm trong lĩnh vực.Bizfly Cloud luôn luôn đi đầu tiên phong trong lĩnh vực Cloud Computing và các bạn sẽ được trải nghiệm các công nghệ Cloud tân tiến nhất trên thế giới.Đồ uống, đồ ăn nhẹ tại văn phòng.Các sự kiện hoạt động văn hóa nhân dịp lễ, tết:Hoạt động kỷ niệm ngày thành lập công ty VCCorpHoạt động kỷ niệm và tặng quà sinh nhật CBCNVHoạt động kỷ niệm các ngày lễ, tết: ngày Quốc Tế Phụ Nữ 8/3, ngày Phụ Nữ Việt Nam 20/10, ngày Lễ Giáng Sinh, Tết Dương Lịch, Tết Trung Thu, Tết Thiếu Nhi...Hội diễn và tiệc tổng kết Sum Up cuối năm Giải bóng đá thường niênCuộc thi hoa hậu Miss VC thường niênRadio Mõ Làng, chương trình phát thanh truyền thông nội bộCác hoạt động liên hoan teambuilding theo nhóm, khối, bộ phận...Chương trình chăm sóc sức khỏe toàn diện VC Health CareThăm khám sức khỏe định kỳ hàng năm tại các bệnh viện cao cấpĐược tham gia các hoạt động trải nghiệm tư vấn chăm sóc sức khỏe từ các chuyên gia y tế, do công ty tổ chức theo hình thức các kênh trực tuyến và trực tiếp tại văn phòng.Chế độ nghỉ dưỡng và phúc lợi:Chế độ nghỉ mát (theo quy chế của công ty).Chế độ nghỉ phép (12 ngày nghỉ phép/năm theo quy định của Luật Lao Động).Chế độ Hiếu, Hỉ, Sinh Con. QUY TRÌNH TUYỂN DỤNG:Xét lọc hồ sơ đạt yêu cầuPhỏng vấn trực tiếp",Công Ty Cổ Phần VCCorp,https://www.topcv.vn/cong-ty/cong-ty-co-phan-vccorp/102367.html,https://www.topcv.vn/viec-lam/business-analyst-crm/1475255.html?ta_source=ITJobs_LinkDetail
"Data Engineer
        (Mid/Senior)",Nhân viên,1 năm,2 người,Toàn thời gian,Không yêu cầu,"Xây dựng, phát triển các hệ thống lưu trữ, xử lý dữ liệu lớn (Big Data)Xây dựng các giải pháp ETL có khả năng mở rộng linh hoạt với độ tin cậy cao, phục vụ cho việc khai thác/ ingest các loại dữ liệu (cấu trúc, lưu lượng, tốc độ) từ nhiều nguồn khác nhauXây dựng, phát triển các công cụ khai thác dữ liệu, quản trị dữ liệuThiết kế chi tiết giải pháp cho các luồng thu thập, chuẩn hóa, làm sạch, làm giàu, lưu trữ, xử lý, phân tích và hiển thị dữ liệu lớnThiết kế giải pháp và trực tiếp phát triển các module, thư viện có tính chất nền tảng, có khả năng tái sử dụng cao, ảnh hưởng diện rộng","Trình độ học vấnTốt nghiệp cử nhân/kỹ sư chuyên ngành Công nghệ thông tin, Điện tử viễn thông, Tài chính, Ngân hàng, Kinh tế hoặc tương đươngƯu tiên có các chứng chỉ chuyên ngành Data Engineer, Data Analysis, Data Sciense cho xử lý dữ liệu lớn  2. Kiến thức/Chuyên môn/Kỹ năng liên quanTrình độ tiếng anh đọc hiểu tài liệu chuyên ngành CNTT, giao tiếp tốt.Kiến thức về lập trình, cấu trúc dữ liệu & giải thuậtCó kinh nghiệm trong việc thiết kế và xây dựng data models, quy trình ETL và ELT dữ liệu từ nguồn về DWH, tối ưu hóa luồng dữ liệuKiến thức về lập trình lưu trữ, xử lý dữ liệu phân tán, xử lý dữ liệu lớn(Hadoop, Spark, Elastic Search ...)Kiến thức xây dựng về luồng xử lý dữ liệu(batch processing, stream processing...)Kiến thức về các loại CSDL(RDBMS, Graph Databases, NoSQL, ....)Kỹ năng sử dụng các ngôn ngữ lập trình(Java, Scalar, Python, R, SQL...)Kỹ năng thành thạo một trong các framework, thư viện lưu trữ, xử lý dữ liệu lớn(Hadoop, Spark, Kafka, Zookeeper...)Kỹ năng sử dụng các CSDL: Oracle, Cassandra, MongoDB, Postgres, SQL Server","Làm việc trong môi trường tài chính năng động, chuyên nghiệp;Lương cạnh tranh, thưởng hấp dẫn;Chế độ bảo hiểm xã hội, teambuilding, du xuân...Làm việc từ thứ 2 đến thứ 6 hàng tuần. Nghỉ Lễ, Tết theo quy định.Hỗ trợ ăn trưa 40k/ suất, gửi xeBảo hiểm sức khỏe Bảo Việt cho CBNV và người thân",CÔNG TY CỔ PHẦN CHỨNG KHOÁN DSC,https://www.topcv.vn/cong-ty/cong-ty-co-phan-chung-khoan-dsc/76436.html,https://www.topcv.vn/viec-lam/data-engineer-mid-senior/1401666.html?ta_source=ITJobs_LinkDetail
Manual Tester,Nhân viên,3 năm,1 người,Toàn thời gian,Không yêu cầu,"Analyze customer requirements, software requirements, design requirements to determine the test requirements of the projectCreate test cases/specs (test conditions, test scripts, actions, input data and expected results)Carry out tests based on test cases and assess the status of test cases (Success or Error)Review, test products before deliveringWork with developers to analyze and find the root of bugsDo manual testing when the project needed","Must have:At least 3 years experience as Tester or QC engineer for web or mobile applicationsHaving solid knowledge and experience in creating test cases using testing define techniquesExperience in different testing levels and testing strategiesNice to have:Experience in API testing using Postman or SOAPUIExperience in performance testing as JMeterExperience in SQL QueriesExperience in Automation tools, framework....","Full salary in probationBonus 13th-month salary; Salary review 2 times/yearSocial Insurance, Health Insurance, Unemployment Insurance (on 100% salary)Working time: Mon-Fri, 8 hours/day, flexible start 8AM-10AM, no overtimeWell-equipped facility: Macbook + additonal monitorAnnual company trip, Annual health check, Happy lunch every month",Công ty TNHH Minma Việt Nam,https://www.topcv.vn/cong-ty/cong-ty-tnhh-minma-viet-nam/158275.html,https://www.topcv.vn/viec-lam/manual-tester/1383451.html?ta_source=ITJobs_LinkDetail
"Lead
            AI Engineer",Trưởng/Phó phòng,3 năm,1 người,Toàn thời gian,Không yêu cầu,Sử dụng Generative AI để thực hiện các nhiệm vụ sau:Xây dựng phương án phát triển sử dụng AIXây dựng phương pháp tự động để tạo test case và xử lý testXây dựng phương án tạo tài liệu tự độngTạo văn hóa sử dụng AI cho team lập trìnhLập phương án và xúc tiến thực hiện các dự án mới sử dụng AITạo prompt cho AILập trình sử dụng AIPhối hợp với QA team để test sử dụng AI Chia sẻ kiến thức và kỹ năng về Generative AI cho các thành viên trong teamQuản lý tiến độ dự án của team,"Ít nhất 3 năm kinh nghiệm về lập trình sử dụng Generative AIÍt nhất 1 năm kinh nghiệm ở vị trí leaderÍt nhất 3 năm kinh nghiệm phát triển web, appCó kinh nghiệm quản lý tiến độ dự án Chúng tôi càng mong đợi hơn nếu bạn:Có thể giao tiếp bằng tiếng Nhật/tiếng AnhCó kinh nghiệm làm việc trong công ty productTừng làm việc tại Nhật hoặc công ty Nhật tại Việt Nam","Mức lương tương xứng với năng lực (Gross 1500 USD – 3500 USD)Thử việc 2 tháng, hưởng 100% lươngThưởng tháng lương 13Đánh giá tăng lương 2 lần/nămĐóng BHXH, BHYT, BHTN trên 100% lươngThời gian làm việc: thứ 2 – thứ 6, mỗi ngày 8 tiếng, flexible timeCung cấp thiết bị: Macbook + màn hìnhDu lịch công ty hàng năm, khám sức khỏe hàng năm, Happy lunch hàng tháng",Công ty TNHH Minma Việt Nam,https://www.topcv.vn/cong-ty/cong-ty-tnhh-minma-viet-nam/158275.html,https://www.topcv.vn/viec-lam/lead-ai-engineer/1474193.html?ta_source=ITJobs_LinkDetail
"Tester
        Data",Quản lý / Giám sát,1 năm,5 người,Toàn thời gian,Không yêu cầu,"Lập kế hoạch test và kịch bản test, chuẩn bị dữ liệu test,Tham gia kiểm thử các dự án phần mềm, data warehouseQuản lý, phân tích kết quả test và báo cáo kết quả test,Phối hợp với các bộ phận khác của công ty để đảm bảo chất lượng dự án,Truyền đạt nội dung, hỗ trợ các thành viên dự án,Kiểm thử chất lượng phần mềm, nghiệm thu sản phẩm trước khi thực hiện chuyển giao,Được đào tạo trở thành Data Analyst hoặc BA IT trong ngân hàng.","Kinh nghiệm >1.5 năm kiểm thử (Manual Tester)Sử dụng thành thạo truy vấn dữ liệu SQLSử dụng thành thạo postman hoặc các tool test APIKỹ năng: Đọc hiểu các tài liệu mô tả và phân tích yêu cầu, tài liệu thiết kế của giải pháp; Cẩn thận, tỉ mỉ và có kinh nghiệm giao tiếp, làm việc nhóm tốt, có khả năng phối hợp với Developer trong quá trình fix bug.Tư duy nhanh nhẹn, ham học hỏiƯu tiên: Có hiểu biết, kinh nghiệm và làm việc 1 trong các hệ thống như Corebanking (T24,...), Card (Way4, CMS,...),Ưu tiên người có kinh nghiệm ngân hàng, công ty tài chính, chứng khoán, bảo hiểm","Mức lương cạnh tranh, Lương tháng 13Hỗ trợ đầy đủ trang thiết bị làm việc PC/ Laptop....Đóng bảo hiểm theo luật lao động Việt Nam (BHXH, BHYT, BHTN)12 ngày phép/ năm và Thưởng vào các dịp lễ khác trong năm (1/1, 30/4-1/5; 2/9, 8/3, 20/10...), Sinh nhật; Chi phí công đoàn thăm hỏi vào các dịp hiếu, hỉ, ốm đau;Làm việc thứ 2 đến thứ 6, Nghỉ Thứ 7, Chủ nhậtPhụ cấp gửi xe; Phụ cấp cơm trưa, ngoài ra phụ cấp điện thoại và đi lại tùy thuộc vào một số vị trí và cấp bậc;Khám sức khỏe định kỳ 1 lần/nămDu lịch nghỉ mát 1 lần/ năm.Tổ chức teambuilding định kỳ, tổ chức sinh nhật, team lunch, ...Happy hours hàng tháng, free snacks, hoa quả, đồ uống.Được đào tạo và trau dồi không chỉ kiến thức chuyên môn, kỹ năng mềm mà cả kỹ năng quản lý nhóm, quản lý dự án thông qua các buổi đào tạo nội bộ chung do phòng Đào tạo tổ chức hoặc các buổi đào tạo của riêng phòng ban;Môi trường làm việc chuyên nghiệp, trẻ trung, năng động, nhiều cơ hội thăng tiếnĐội ngũ kỹ sư, nhân viên tài năng, giàu kinh nghiệmLàm việc với tác đối tác lớnReview tăng lương định kỳ hàng năm (2 lần / năm)",Công ty TNHH Giải pháp Phân tích dữ liệu Insight Data,https://www.topcv.vn/cong-ty/cong-ty-tnhh-giai-phap-phan-tich-du-lieu-insight-data/110386.html,https://www.topcv.vn/viec-lam/tester-data/1474931.html?ta_source=ITJobs_LinkDetail
